{
  "contract_version": "1.0.0",
  "action_id": "action:run-required-test-selection",
  "proposed_by": "llm",
  "action_type": "run_tests",
  "tool": "bin/adlc loop-test-selection",
  "rationale": "The next useful step is to prove required tests cannot be skipped.",
  "expected_observation": "The complete test plan satisfies the mandatory floor and task-signal required tests.",
  "required_preconditions": ["safe_checkpoint", "allowed_tool", "required_tests_declared"],
  "satisfies_required_tests": ["floor:schema", "required:test-selection"],
  "control_event_type": null,
  "safe_checkpoint_required": true,
  "rollback_note": "No rollback needed; this is a read-only validation command.",
  "evidence_refs": [
    "tests/fixtures/loop_maturity/test-plan-complete-required.json"
  ]
}

